{
  "schema_version": "1.0",
  "run_id": "extract-kimsuky_060-deepseek-v4-flash-1.0-1.0-20260714080126064075-1c841634",
  "doc_id": "kimsuky_060",
  "model_name": "deepseek-v4-flash",
  "prompt_version": "1.0",
  "generated_at": "2026-07-14T08:01:26.064075+00:00",
  "chunks": [
    {
      "chunk_id": "kimsuky_060_c001",
      "rejected_entities": [
        {
          "name": "Lazarus Group",
          "type": "APT_GROUP",
          "aliases": [],
          "description": "North Korea-linked threat actor",
          "mention_text": "Lazarus Group",
          "evidence_text": "The notorious North Korea-linked threat actor known as the Lazarus Group",
          "char_start": null,
          "char_end": null,
          "confidence": 0.95,
          "candidate_status": "rejected",
          "validation_status": "invalid",
          "validation_errors": [
            "evidence_text 未出现在 document.clean_text 中"
          ],
          "audit_reason": "validation_failed"
        },
        {
          "name": "CVE-2021-44228",
          "type": "CVE",
          "aliases": [
            "Log4Shell"
          ],
          "description": "Log4j vulnerability",
          "mention_text": "CVE-2021-44228",
          "evidence_text": "CVE-2021-44228 (aka Log4Shell)",
          "char_start": null,
          "char_end": null,
          "confidence": 0.95,
          "candidate_status": "rejected",
          "validation_status": "invalid",
          "validation_errors": [
            "evidence_text 未出现在 document.clean_text 中"
          ],
          "audit_reason": "validation_failed"
        },
        {
          "name": "Kimsuky",
          "type": "APT_GROUP",
          "aliases": [
            "APT43",
            "ARCHIPELAGO",
            "Black Banshee",
            "Emerald Sleet",
            "Thallium",
            "Nickel Kimball",
            "Velvet Chollima"
          ],
          "description": "North Korean APT group under RGB",
          "mention_text": "Kimsuky",
          "evidence_text": "Kimusky, also known by the names APT43, ARCHIPELAGO, Black Banshee, Emerald Sleet (previously Thallium), Nickel Kimball, and Velvet Chollima",
          "char_start": null,
          "char_end": null,
          "confidence": 0.95,
          "candidate_status": "rejected",
          "validation_status": "invalid",
          "validation_errors": [
            "evidence_text 未出现在 document.clean_text 中"
          ],
          "audit_reason": "validation_failed"
        },
        {
          "name": "Veracode",
          "type": "ORGANIZATION",
          "aliases": [],
          "description": "Software security company",
          "mention_text": "Veracode",
          "evidence_text": "according to Veracode",
          "char_start": null,
          "char_end": null,
          "confidence": 0.9,
          "candidate_status": "rejected",
          "validation_status": "invalid",
          "validation_errors": [
            "evidence_text 未出现在 document.clean_text 中"
          ],
          "audit_reason": "validation_failed"
        },
        {
          "name": "U.S. Treasury Department",
          "type": "ORGANIZATION",
          "aliases": [],
          "description": "US government department",
          "mention_text": "U.S. Treasury Department",
          "evidence_text": "sanctioned by the U.S. Treasury Department",
          "char_start": null,
          "char_end": null,
          "confidence": 0.95,
          "candidate_status": "rejected",
          "validation_status": "invalid",
          "validation_errors": [
            "evidence_text 未出现在 document.clean_text 中"
          ],
          "audit_reason": "validation_failed"
        },
        {
          "name": "November 30, 2023",
          "type": "TIME",
          "aliases": [],
          "description": "Date of sanctions",
          "mention_text": "November 30, 2023",
          "evidence_text": "sanctioned by the U.S. Treasury Department on November 30, 2023",
          "char_start": null,
          "char_end": null,
          "confidence": 0.95,
          "candidate_status": "rejected",
          "validation_status": "invalid",
          "validation_errors": [
            "evidence_text 未出现在 document.clean_text 中"
          ],
          "audit_reason": "validation_failed"
        }
      ],
      "rejected_relations": [
        {
          "head_name": "Lazarus Group",
          "head_type": "APT_GROUP",
          "relation_type": "ATTRIBUTED_TO",
          "tail_name": "North Korea",
          "tail_type": "COUNTRY",
          "evidence_text": "The notorious North Korea-linked threat actor known as the Lazarus Group",
          "char_start": null,
          "char_end": null,
          "confidence": 0.95,
          "candidate_status": "rejected",
          "validation_status": "invalid",
          "validation_errors": [
            "head (Lazarus Group, APT_GROUP) 不在候选实体中",
            "evidence_text 未出现在 document.clean_text 中"
          ],
          "audit_reason": "validation_failed"
        },
        {
          "head_name": "Operation Blacksmith",
          "head_type": "CAMPAIGN",
          "relation_type": "ATTRIBUTED_TO",
          "tail_name": "Lazarus Group",
          "tail_type": "APT_GROUP",
          "evidence_text": "Cisco Talos is tracking the activity under the name Operation Blacksmith, noting the use of three DLang-based malware families",
          "char_start": 275,
          "char_end": 401,
          "confidence": 0.9,
          "candidate_status": "rejected",
          "validation_status": "invalid",
          "validation_errors": [
            "不允许组合 (CAMPAIGN,ATTRIBUTED_TO,APT_GROUP)",
            "tail (Lazarus Group, APT_GROUP) 不在候选实体中"
          ],
          "audit_reason": "validation_failed"
        },
        {
          "head_name": "Operation Blacksmith",
          "head_type": "CAMPAIGN",
          "relation_type": "USES",
          "tail_name": "BottomLoader",
          "tail_type": "MALWARE",
          "evidence_text": "Operation Blacksmith, noting the use of three DLang-based malware families, including ... a downloader dubbed BottomLoader",
          "char_start": null,
          "char_end": null,
          "confidence": 0.95,
          "candidate_status": "rejected",
          "validation_status": "invalid",
          "validation_errors": [
            "evidence_text 未出现在 document.clean_text 中"
          ],
          "audit_reason": "validation_failed"
        },
        {
          "head_name": "Lazarus Group",
          "head_type": "APT_GROUP",
          "relation_type": "USES",
          "tail_name": "NineRAT",
          "tail_type": "MALWARE",
          "evidence_text": "The notorious North Korea-linked threat actor known as the Lazarus Group has been attributed to a new global campaign that involves ... deploying ... NineRAT",
          "char_start": null,
          "char_end": null,
          "confidence": 0.9,
          "candidate_status": "rejected",
          "validation_status": "invalid",
          "validation_errors": [
            "head (Lazarus Group, APT_GROUP) 不在候选实体中",
            "evidence_text 未出现在 document.clean_text 中"
          ],
          "audit_reason": "validation_failed"
        },
        {
          "head_name": "Lazarus Group",
          "head_type": "APT_GROUP",
          "relation_type": "USES",
          "tail_name": "HazyLoad",
          "tail_type": "TOOL",
          "evidence_text": "Also used in the attacks after initial reconnaissance is a custom proxy tool called HazyLoad that was previously identified by Microsoft as used by the threat actor",
          "char_start": null,
          "char_end": null,
          "confidence": 0.9,
          "candidate_status": "rejected",
          "validation_status": "invalid",
          "validation_errors": [
            "head (Lazarus Group, APT_GROUP) 不在候选实体中",
            "evidence_text 未出现在 document.clean_text 中"
          ],
          "audit_reason": "validation_failed"
        },
        {
          "head_name": "Lazarus Group",
          "head_type": "APT_GROUP",
          "relation_type": "USES",
          "tail_name": "BottomLoader",
          "tail_type": "MALWARE",
          "evidence_text": "HazyLoad is downloaded and executed by means of another malware called BottomLoader",
          "char_start": 2989,
          "char_end": 3072,
          "confidence": 0.9,
          "candidate_status": "rejected",
          "validation_status": "invalid",
          "validation_errors": [
            "head (Lazarus Group, APT_GROUP) 不在候选实体中"
          ],
          "audit_reason": "validation_failed"
        },
        {
          "head_name": "Andariel",
          "head_type": "APT_GROUP",
          "relation_type": "PART_OF",
          "tail_name": "Lazarus Group",
          "tail_type": "APT_GROUP",
          "evidence_text": "the cluster widely tracked as Andariel (aka Onyx Sleet or Silent Chollima), a sub-group within the Lazarus umbrella",
          "char_start": 651,
          "char_end": 766,
          "confidence": 0.95,
          "candidate_status": "rejected",
          "validation_status": "invalid",
          "validation_errors": [
            "不允许组合 (APT_GROUP,PART_OF,APT_GROUP)",
            "tail (Lazarus Group, APT_GROUP) 不在候选实体中"
          ],
          "audit_reason": "validation_failed"
        },
        {
          "head_name": "Andariel",
          "head_type": "APT_GROUP",
          "relation_type": "EXPLOITS",
          "tail_name": "CVE-2021-44228",
          "tail_type": "CVE",
          "evidence_text": "Attack chains involve the exploitation of CVE-2021-44228 (aka Log4Shell) against publicly-accessible VMWare Horizon servers to deliver NineRAT",
          "char_start": null,
          "char_end": null,
          "confidence": 0.95,
          "candidate_status": "rejected",
          "validation_status": "invalid",
          "validation_errors": [
            "tail (CVE-2021-44228, CVE) 不在候选实体中",